{
  "$schema": "https://json-schema.org/draft/2020-12/schema",
  "title": "A Yorehold spell (spells/<id>.json)",
  "type": "object",
  "required": [
    "id"
  ],
  "properties": {
    "id": {
      "type": "string",
      "pattern": "^[a-z0-9_-]{1,64}$",
      "description": "a-z, 0-9, - and _; the file name without .json"
    },
    "name": {
      "type": "string"
    },
    "description": {
      "type": "string"
    },
    "order": {
      "type": "integer"
    },
    "cost": {
      "type": [
        "integer",
        "string"
      ],
      "description": "actions it takes, or \"bonus\"; a weapon's hands if left out"
    },
    "endsTurn": {
      "type": "boolean"
    },
    "general": {
      "type": "boolean",
      "description": "false: only those granted it have it"
    },
    "readies": {
      "type": "string"
    },
    "secret": {
      "type": "boolean",
      "description": "its rolls aren't thrown on screen"
    },
    "requires": {
      "type": "object",
      "additionalProperties": false,
      "properties": {
        "flags": {
          "type": "array",
          "items": {
            "type": "string"
          }
        },
        "without": {
          "type": "array",
          "items": {
            "type": "string"
          }
        },
        "resources": {
          "type": "object",
          "additionalProperties": {
            "type": "integer"
          }
        }
      }
    },
    "target": {
      "type": "object",
      "additionalProperties": false,
      "properties": {
        "kind": {
          "enum": [
            "self",
            "creature",
            "point"
          ]
        },
        "side": {
          "enum": [
            "enemy",
            "ally",
            "any"
          ]
        },
        "range": {
          "type": [
            "integer",
            "string"
          ],
          "description": "squares, or \"weapon\": as far as the weapon in hand"
        },
        "downed": {
          "type": "boolean"
        }
      }
    },
    "area": {
      "type": "object",
      "additionalProperties": false,
      "properties": {
        "shape": {
          "enum": [
            "burst",
            "cone",
            "line"
          ]
        },
        "size": {
          "type": "number"
        },
        "width": {
          "type": "number"
        },
        "angle": {
          "type": "number"
        }
      }
    },
    "log": {
      "type": "string"
    },
    "save": {
      "type": "object",
      "additionalProperties": false,
      "properties": {
        "ability": {
          "type": "string"
        },
        "dc": {
          "type": [
            "integer",
            "string"
          ]
        }
      }
    },
    "effects": {
      "type": "array",
      "items": {
        "$ref": "#/$defs/step"
      }
    },
    "level": {
      "type": "integer",
      "description": "0 = cantrip"
    },
    "hands": {
      "type": "integer"
    },
    "concentration": {
      "type": "boolean"
    },
    "spends": {
      "type": "object",
      "additionalProperties": {
        "type": "integer"
      }
    }
  },
  "additionalProperties": false,
  "$defs": {
    "step": {
      "type": "object",
      "required": [
        "do"
      ],
      "properties": {
        "do": {
          "enum": [
            "damage",
            "heal",
            "tempHp",
            "condition",
            "modifier",
            "move",
            "resource",
            "summon",
            "light",
            "surface",
            "flag",
            "roll",
            "repeat",
            "choose"
          ]
        },
        "target": {
          "enum": [
            "self",
            "target",
            "area",
            "allies",
            "enemies"
          ]
        },
        "when": {
          "type": "string",
          "description": "an outcome of the roll above it (hit, miss, crit, saveFailed, success, criticalFailure...) or an event"
        },
        "ifFlag": {
          "type": "string"
        },
        "scale": {
          "type": "object",
          "additionalProperties": false,
          "properties": {
            "by": {
              "enum": [
                "level",
                "slot"
              ]
            },
            "from": {
              "type": "integer"
            },
            "every": {
              "type": "integer"
            },
            "dice": {
              "type": "string",
              "description": "dice such as 2d6+1, with formulas in braces: 2d8+{mod.wis}; Foundry's @paths read too"
            },
            "value": {
              "type": "integer"
            }
          }
        },
        "onSave": {
          "enum": [
            "half",
            "none",
            "full"
          ]
        },
        "dice": {
          "type": [
            "string",
            "integer"
          ],
          "description": "dice such as 2d6+1, with formulas in braces: 2d8+{mod.wis}; Foundry's @paths read too"
        },
        "type": {
          "type": "string"
        },
        "crit": {
          "type": "string",
          "description": "dice such as 2d6+1, with formulas in braces: 2d8+{mod.wis}; Foundry's @paths read too"
        },
        "minimum": {
          "type": "integer"
        },
        "track": {
          "type": "string"
        },
        "id": {
          "type": "string"
        },
        "remove": {
          "type": "boolean"
        },
        "duration": {
          "type": "integer"
        },
        "value": {
          "type": "integer"
        },
        "stat": {
          "type": "string"
        },
        "op": {
          "type": "string"
        },
        "how": {
          "type": "string",
          "description": "a move: push, pull, teleport, approach; a resource: spend, restore"
        },
        "distance": {
          "type": [
            "integer",
            "string"
          ]
        },
        "amount": {
          "type": [
            "integer",
            "string"
          ]
        },
        "count": {
          "type": "integer"
        },
        "radius": {
          "type": "number"
        },
        "size": {
          "type": "number"
        },
        "kind": {
          "type": "string",
          "description": "a roll: attack, check, save, or one of the system's roll kinds"
        },
        "ability": {
          "type": "string"
        },
        "dc": {
          "type": [
            "integer",
            "string"
          ],
          "description": "a number, or \"caster\""
        },
        "against": {
          "type": "string"
        },
        "reach": {
          "type": "integer"
        },
        "steps": {
          "type": "array",
          "items": {
            "$ref": "#/$defs/step"
          }
        },
        "times": {
          "type": "string"
        },
        "options": {
          "type": "array",
          "items": {
            "type": "object",
            "properties": {
              "name": {
                "type": "string"
              },
              "steps": {
                "type": "array",
                "items": {
                  "$ref": "#/$defs/step"
                }
              }
            }
          }
        }
      }
    }
  }
}
