{
  "id": "vicious-mockery",
  "name": "Vicious Mockery",
  "description": "Words that wound: 1d6 psychic unless it makes a Wisdom save, more dice at levels 5, 11 and 17.",
  "level": 0,
  "hands": 0,
  "target": {
    "kind": "creature",
    "side": "enemy",
    "range": 12
  },
  "save": {
    "ability": "wis",
    "dc": "caster"
  },
  "effects": [
    {
      "do": "damage",
      "dice": "{1 + (level >= 5) + (level >= 11) + (level >= 17)}d6",
      "type": "psychic",
      "onSave": "none"
    }
  ]
}
