{
  "id": "iron-vow",
  "name": "Iron vow",
  "description": "One ally within six squares gets +2 AC while the cleric holds the vow.",
  "level": 2,
  "hands": 1,
  "concentration": true,
  "target": { "kind": "creature", "side": "ally", "range": 6 },
  "effects": [
    { "do": "modifier", "stat": "ac", "value": 2, "duration": 10 }
  ]
}
