{
  "id": "produce-flame",
  "name": "Produce Flame",
  "description": "A flame hurled from the hand: a ranged spell attack for 1d8 fire, more dice at levels 5, 11 and 17.",
  "level": 0,
  "hands": 1,
  "target": {
    "kind": "creature",
    "side": "enemy",
    "range": 12
  },
  "effects": [
    {
      "do": "roll",
      "kind": "attack",
      "ability": "caster",
      "steps": [
        {
          "do": "damage",
          "dice": "{1 + (level >= 5) + (level >= 11) + (level >= 17)}d8",
          "type": "fire",
          "when": "hit"
        }
      ]
    }
  ]
}
